{
  "$schema": "file:///home/laughingman/.omp/agent/extensions/permission-gate/config.schema.json",
  "defaultLevel": "low",
  "profiles": {
    "low": {
      "allowlist": [
        "cd *",
        "pwd",
        "ls *",
        "cat *",
        "head *",
        "tail *",
        "less *",
        "file *",
        "stat *",
        "wc *",
        "tree *",
        "readlink *",
        "realpath *",
        "printf *",
        "echo *",
        "sort *",
        "tr *",
        "diff *",
        "cmp *",
        "comm *",
        "paste *",
        "cut *",
        "uniq *",
        "basename *",
        "dirname *",
        "seq *",
        "true *",
        "test *",
        "break *",
        "continue *",
        "exit *",
        "return *",
        "shift *",
        "read *",
        "jq *",
        "md5sum *",
        "sha1sum *",
        "sha224sum *",
        "sha256sum *",
        "sha384sum *",
        "sha512sum *",
        "b2sum *",
        "which *",
        "whereis *",
        "type *",
        "sed *",
        "awk *",
        "rg *",
        "grep *",
        "find *",
        "fd *",
        "ag *",
        "ack *",
        "locate *",
        "lsof *",
        "ss *",
        "curl *",
        "git status *",
        "git diff *",
        "git log *",
        "git show *",
        "git blame *",
        "git rev-parse *",
        "git rev-list *",
        "git merge-base *",
        "git ls-files *",
        "git ls-tree *",
        "git worktree list *",
        "git remote -v",
        "git for-each-ref *",
        "git grep *",
        "git cat-file *",
        "git check-ignore *",
        "git ls-remote *",
        "git branch --show-current",
        "git branch --list *",
        "git branch -a",
        "git branch -r",
        "git branch -v",
        "git branch -vv",
        "git branch -a *",
        "git branch -r *",
        "git branch -v *",
        "git branch -vv *",
        "git config --get *",
        "git config --get-all *",
        "git config --get-regexp *",
        "git config --list *",
        "git reflog *",
        "git archive *",
        "git tag --list *",
        "git stash list *",
        "git stash show *",
        "env",
        "printenv *",
        "ps *",
        "pgrep *",
        "uname *",
        "whoami",
        "id *",
        "nproc *",
        "uptime *",
        "free *",
        "df *",
        "du *",
        "lsblk *",
        "lscpu *",
        "date *",
        "sleep *",
        "host *",
        "dig *",
        "nslookup *",
        "ping -c *",
        "npm list *",
        "npm ls *",
        "npm view *",
        "npm info *",
        "npm outdated *",
        "yarn list *",
        "yarn info *",
        "pip list *",
        "pip show *",
        "pip freeze *",
        "cargo tree *",
        "go list *",
        "openspec --help",
        "openspec --version",
        "openspec * --help",
        "openspec instructions *",
        "openspec list *",
        "openspec show *",
        "openspec status *",
        "openspec validate *",
        "bunx openspec --help",
        "bunx openspec --version",
        "bunx openspec * --help",
        "bunx openspec instructions *",
        "bunx openspec list *",
        "bunx openspec show *",
        "bunx openspec status *",
        "bunx openspec validate *",
        "docker compose *",
        "docker ps *",
        "bunx prettier --check *",
        "bunx prettier --list-different *",
        "bun x prettier --check *",
        "bun x prettier --list-different *",
        "prettier --check *",
        "prettier --list-different *",
        "bunx tsc --noEmit *",
        "bun x tsc --noEmit *",
        "tsc --noEmit *",
        "bun run typecheck",
        "bun run typecheck *",
        "bun test",
        "bun test *",
        "bunx eslint *",
        "bun x eslint *",
        "eslint *",
        "bunx biome check *",
        "bunx biome lint *",
        "bun x biome check *",
        "bun x biome lint *",
        "biome check *",
        "biome lint *",
        "bunx oxlint *",
        "bun x oxlint *",
        "oxlint *",
        "ruff check *",
        "ruff format --check *",
        "black --check *",
        "mypy *"
      ],
      "denylist": []
    },
    "medium": {
      "allowlist": [
        "mv *",
        "cp *",
        "mkdir *",
        "touch *",
        "ln *",
        "rm *",
        "rmdir *",
        "git add *",
        "git commit *",
        "git checkout *",
        "git switch *",
        "git stash *",
        "git merge *",
        "git rebase *",
        "git restore *",
        "git cherry-pick *",
        "git revert *",
        "git fetch *",
        "git pull *",
        "git branch *",
        "git tag *",
        "npm *",
        "npx *",
        "yarn *",
        "pnpm *",
        "bun *",
        "bunx *",
        "node *",
        "deno *",
        "pip *",
        "python *",
        "python3 *",
        "pytest *",
        "poetry *",
        "uv *",
        "cargo *",
        "rustc *",
        "rustfmt *",
        "go *",
        "make *",
        "cmake *",
        "gradle *",
        "mvn *",
        "curl *",
        "wget *",
        "docker build *",
        "docker images *",
        "docker ps *",
        "docker logs *"
      ],
      "denylist": [
        "git push *",
        "git clean -f*",
        "git clean -d*f*",
        "rm -rf *",
        "sudo *",
        "doas *",
        "su *",
        "docker compose up *",
        "docker compose down *",
        "docker run *",
        "kubectl *",
        "terraform apply *",
        "terraform destroy *",
        "pulumi up *",
        "pulumi destroy *"
      ]
    },
    "high": {
      "allowlist": [
        "*"
      ],
      "denylist": [
        "sudo *",
        "doas *",
        "su *",
        "git push *--force*",
        "git push *-f *",
        "git clean -f*",
        "git clean -d*f*",
        "rm -rf *",
        "chmod -R *",
        "chown -R *",
        "systemctl *",
        "service *",
        "iptables *",
        "ufw *",
        "passwd *",
        "useradd *",
        "userdel *",
        "groupadd *",
        "groupdel *"
      ]
    }
  },
  "commandBlocklist": [
    "mkfs*",
    "wipefs *",
    "shutdown *",
    "reboot *",
    "halt *",
    "poweroff *",
    "rm -rf /",
    "rm -rf /*",
    "dd *of=/dev/*"
  ],
  "paths": {
    "denylist": [
      "**/.env",
      "**/.env.*",
      "**/.ssh/**",
      "**/.gnupg/**",
      "**/.aws/credentials",
      "**/.netrc",
      "**/.npmrc",
      "**/.pypirc",
      "**/.config/*token*",
      "**/.config/**/*token*"
    ],
    "allowlist": [
      "**/.env.example",
      "**/.env.sample"
    ],
    "externalDirectory": "ask",
    "externalAllowlist": [],
    "externalReadAllowlist": [
      "/tmp",
      "/tmp/*"
    ]
  },
  "customEnvironment": "ask",
  "pty": "ask"
}
